{
    "PixelPerRadialElement": 1,
    "Imagesize": [
        1043,
        981
    ],
    "Tilt": {
        "TiltAngleDeg": 0.822,
        "TiltRotDeg": -37.448
    },
    "PolarizationCorrection": {
        "Angle": 0,
        "Fraction": 0.95
    },
    "MaskFile": "data/AAA_integ.msk",
    "Oversampling": 2,
    "PixelSizeMicroM": [
        172.0,
        172.0
    ],
    "Wavelength": 1.54,
    "BeamCenter": [
        431.935,
        894.243
    ],
    "DedectorDistanceMM": 1059.5
}